{
  "bootstrap_block_length": 3,
  "bootstrap_interval_level": 0.95,
  "bootstrap_replications": 2000,
  "interval_scale_floor": 0.001,
  "maximum_absolute_weighted_relative_bias": 0.1,
  "maximum_admission_interval_relative_width": 0.5,
  "maximum_background_interval_relative_width": 0.75,
  "maximum_capacity_coefficient_of_variation": 0.1,
  "maximum_capacity_interval_relative_width": 0.25,
  "maximum_deadline_coefficient_of_variation": 0.05,
  "maximum_max_wait_interval_relative_width": 0.25,
  "maximum_scaled_condition_number": 30.0,
  "maximum_scaled_target_hull_distance": 1e-09,
  "maximum_service_interval_relative_width": 0.5,
  "maximum_weighted_normalized_rmse": 0.2,
  "minimum_active_admission_blocks": 24,
  "minimum_bootstrap_success_fraction": 0.9,
  "minimum_calibration_time_blocks": 30,
  "minimum_observations_per_resource": 30,
  "minimum_unique_admission_rates": 4,
  "minimum_unique_fleet_sizes": 4,
  "minimum_unique_joint_predictor_vectors": 8,
  "minimum_weighted_r_squared": 0.8,
  "minimum_zero_admission_blocks": 6,
  "policy_id": "successor-calibration-engineering-draft-v1",
  "root_seed": 2026082001,
  "study_mode": "successor_transfer",
  "target_admission_rate_max_per_s": 100.0,
  "target_admission_rate_min_per_s": 0.0,
  "target_fleet_size_max": 10000,
  "target_fleet_size_min": 100
}
